{
  "schemaVersion": "1.2",
  "catalogId": "foundation-v2",
  "rulesProfile": "historical-foundation-fixtures",
  "basis": "HISTORICAL_TEST_FIXTURE",
  "cards": [
    {
      "schemaVersion": "1.1",
      "cardId": "CS2_182",
      "revision": "foundation-v1",
      "name": "Chillwind Yeti",
      "type": "MINION",
      "classes": [
        "NEUTRAL"
      ],
      "baseStats": {
        "manaCost": 4,
        "attack": 4,
        "health": 5
      },
      "collectible": true,
      "set": "BASIC",
      "rarity": "FREE",
      "tribes": [],
      "spellSchool": null,
      "keywords": [],
      "mechanics": [],
      "text": {
        "enUS": ""
      },
      "playConditions": [],
      "abilities": [],
      "sources": [
        "https://github.com/siva-msft/RosettaStone/blob/master/Documents/CardList.md"
      ]
    },
    {
      "schemaVersion": "1.1",
      "cardId": "CS2_179",
      "revision": "foundation-v1",
      "name": "Sen'jin Shieldmasta",
      "type": "MINION",
      "classes": [
        "NEUTRAL"
      ],
      "baseStats": {
        "manaCost": 4,
        "attack": 3,
        "health": 5
      },
      "collectible": true,
      "set": "BASIC",
      "rarity": "FREE",
      "tribes": [],
      "spellSchool": null,
      "keywords": [
        "TAUNT"
      ],
      "mechanics": [],
      "text": {
        "enUS": "Taunt"
      },
      "playConditions": [],
      "abilities": [],
      "sources": [
        "https://github.com/siva-msft/RosettaStone/blob/master/Documents/CardList.md"
      ]
    },
    {
      "schemaVersion": "1.1",
      "cardId": "CS2_042",
      "revision": "foundation-v1",
      "name": "Fire Elemental",
      "type": "MINION",
      "classes": [
        "SHAMAN"
      ],
      "baseStats": {
        "manaCost": 6,
        "attack": 6,
        "health": 5
      },
      "collectible": true,
      "set": "BASIC",
      "rarity": "FREE",
      "tribes": [],
      "spellSchool": null,
      "keywords": [],
      "mechanics": [
        "BATTLECRY"
      ],
      "text": {
        "enUS": "Battlecry: Deal 3 damage."
      },
      "playConditions": [],
      "abilities": [
        {
          "kind": "BATTLECRY",
          "targeting": {
            "mode": "REQUIRED_IF_AVAILABLE",
            "bindAs": "chosenTarget",
            "selector": {
              "zone": "PLAY",
              "entityKind": "CHARACTER",
              "controller": "ANY",
              "exclude": [
                "SELF"
              ]
            },
            "legalityPolicy": "BATTLECRY_SELECTED_TARGET"
          },
          "effects": [
            {
              "op": "DEAL_DAMAGE",
              "amount": {
                "kind": "CONSTANT",
                "value": 3
              },
              "recipient": {
                "kind": "BOUND_TARGET",
                "name": "chosenTarget"
              },
              "missingRecipient": "SKIP",
              "application": "SINGLE_HIT",
              "damageClass": "ABILITY"
            }
          ]
        }
      ],
      "sources": [
        "https://github.com/siva-msft/RosettaStone/blob/master/Documents/CardList.md"
      ]
    },
    {
      "schemaVersion": "1.1",
      "cardId": "CS2_022",
      "revision": "foundation-v1",
      "name": "Polymorph",
      "type": "SPELL",
      "classes": [
        "MAGE"
      ],
      "baseStats": {
        "manaCost": 4
      },
      "collectible": true,
      "set": "BASIC",
      "rarity": "FREE",
      "tribes": [],
      "spellSchool": null,
      "keywords": [],
      "mechanics": [
        "TRANSFORM"
      ],
      "text": {
        "enUS": "Transform a minion into a 1/1 Sheep."
      },
      "playConditions": [],
      "abilities": [
        {
          "kind": "SPELL_EFFECT",
          "targeting": {
            "mode": "REQUIRED",
            "bindAs": "chosenTarget",
            "selector": {
              "zone": "PLAY",
              "entityKind": "MINION",
              "controller": "ANY"
            },
            "legalityPolicy": "SPELL_SELECTED_TARGET"
          },
          "effects": [
            {
              "op": "TRANSFORM",
              "recipient": {
                "kind": "BOUND_TARGET",
                "name": "chosenTarget"
              },
              "targetDefinition": {
                "cardId": "CS2_tk1",
                "revision": "foundation-v1"
              },
              "missingRecipient": "SKIP"
            }
          ]
        }
      ],
      "sources": [
        "https://github.com/siva-msft/RosettaStone/blob/master/Documents/CardList.md"
      ]
    },
    {
      "schemaVersion": "1.1",
      "cardId": "CS2_tk1",
      "revision": "foundation-v1",
      "name": "Sheep",
      "type": "MINION",
      "classes": [
        "MAGE"
      ],
      "baseStats": {
        "manaCost": 1,
        "attack": 1,
        "health": 1
      },
      "collectible": false,
      "set": "BASIC",
      "rarity": "FREE",
      "tribes": [
        "BEAST"
      ],
      "spellSchool": null,
      "keywords": [],
      "mechanics": [],
      "text": {
        "enUS": ""
      },
      "playConditions": [],
      "abilities": [],
      "sources": [
        "https://github.com/siva-msft/RosettaStone/blob/master/Documents/CardList.md",
        "https://gist.github.com/Patashu/a9102c0dcdb5d199cee7"
      ]
    },
    {
      "schemaVersion": "1.1",
      "cardId": "CS2_032",
      "revision": "foundation-v1",
      "name": "Flamestrike",
      "type": "SPELL",
      "classes": [
        "MAGE"
      ],
      "baseStats": {
        "manaCost": 7
      },
      "collectible": true,
      "set": "BASIC",
      "rarity": "FREE",
      "tribes": [],
      "spellSchool": null,
      "keywords": [],
      "mechanics": [],
      "text": {
        "enUS": "Deal 4 damage to all enemy minions."
      },
      "playConditions": [],
      "abilities": [
        {
          "kind": "SPELL_EFFECT",
          "effects": [
            {
              "op": "DEAL_DAMAGE",
              "amount": {
                "kind": "CONSTANT",
                "value": 4
              },
              "recipient": {
                "kind": "QUERY",
                "selector": {
                  "zone": "PLAY",
                  "entityKind": "MINION",
                  "controller": "OPPONENT_OF_EFFECT_CONTROLLER"
                },
                "capture": "EFFECT_START"
              },
              "missingRecipient": "SKIP",
              "application": "SINGLE_DAMAGE_BATCH",
              "damageClass": "SPELL"
            }
          ]
        }
      ],
      "sources": [
        "https://github.com/siva-msft/RosettaStone/blob/master/Documents/CardList.md",
        "https://hearthsim.info/blog/new-site-new-blog-new-events-api/"
      ]
    },
    {
      "schemaVersion": "1.1",
      "cardId": "CS2_029",
      "revision": "foundation-v1",
      "name": "Fireball",
      "type": "SPELL",
      "classes": [
        "MAGE"
      ],
      "baseStats": {
        "manaCost": 4
      },
      "collectible": true,
      "set": "BASIC",
      "rarity": "FREE",
      "tribes": [],
      "spellSchool": null,
      "keywords": [],
      "mechanics": [],
      "text": {
        "enUS": "Deal 6 damage."
      },
      "playConditions": [],
      "abilities": [
        {
          "kind": "SPELL_EFFECT",
          "targeting": {
            "mode": "REQUIRED",
            "bindAs": "chosenTarget",
            "selector": {
              "zone": "PLAY",
              "entityKind": "CHARACTER",
              "controller": "ANY"
            },
            "legalityPolicy": "SPELL_SELECTED_TARGET"
          },
          "effects": [
            {
              "op": "DEAL_DAMAGE",
              "amount": {
                "kind": "CONSTANT",
                "value": 6
              },
              "recipient": {
                "kind": "BOUND_TARGET",
                "name": "chosenTarget"
              },
              "missingRecipient": "SKIP",
              "application": "SINGLE_HIT",
              "damageClass": "SPELL"
            }
          ]
        }
      ],
      "sources": [
        "https://github.com/siva-msft/RosettaStone/blob/master/Documents/CardList.md",
        "https://hearthstone.blizzard.com/en-us/cards/315-fireball"
      ]
    },
    {
      "schemaVersion": "1.2",
      "cardId": "EX1_015",
      "revision": "foundation-v2",
      "name": "Novice Engineer",
      "type": "MINION",
      "classes": [
        "NEUTRAL"
      ],
      "baseStats": {
        "manaCost": 2,
        "attack": 1,
        "health": 1
      },
      "collectible": true,
      "set": "BASIC",
      "rarity": "FREE",
      "tribes": [],
      "spellSchool": null,
      "keywords": [],
      "mechanics": [
        "BATTLECRY"
      ],
      "text": {
        "enUS": "Battlecry: Draw a card."
      },
      "playConditions": [],
      "abilities": [
        {
          "kind": "BATTLECRY",
          "effects": [
            {
              "op": "DRAW_CARD",
              "count": 1,
              "targetPlayer": "EFFECT_CONTROLLER"
            }
          ]
        }
      ],
      "sources": [
        "https://hearthstone.blizzard.com/en-gb/cards/284-novice-engineer/",
        "https://github.com/siva-msft/RosettaStone/blob/master/Documents/CardList.md"
      ]
    }
  ]
}
